{
  "$schema": "https://json-schema.org/draft/2020-12/schema",
  "$id": "https://klayout-tools.org/benchmarks/design-agent/schema/layout-task.schema.json",
  "title": "Layout-flow benchmark task (klt.design_agent_benchmark.layout_task/1)",
  "description": "One task of the layout-flow benchmark (epic #2252): a frozen schematic netlist + spec -- never a layout -- plus the repo-frozen artifacts that make the task eligible under layout-protocol.json's `task_eligibility` rules. Extends task.schema.json rather than forking it: `block_spec` is that schema's own definition. Layout tasks live beside circuit tasks as `tasks/layout/<id>.json` (phase 2, #3025); pass/fail for a *run* is never defined here -- it is the protocol's frozen validity gate.",
  "type": "object",
  "additionalProperties": false,
  "required": [
    "schema",
    "id",
    "title",
    "pdk",
    "description",
    "block_spec",
    "frozen_netlist",
    "reference_layout",
    "generator_recipe",
    "negative_controls"
  ],
  "$defs": {
    "sha256": { "type": "string", "pattern": "^[0-9a-f]{64}$" },
    "repoPath": {
      "type": "string",
      "minLength": 1,
      "description": "Repository-relative path; absolute paths and '..' segments are rejected by the validator.",
      "pattern": "^[^/\\\\][^\\\\]*$"
    },
    "frozenFile": {
      "type": "object",
      "additionalProperties": false,
      "required": ["path", "sha256"],
      "properties": {
        "path": { "$ref": "#/$defs/repoPath" },
        "sha256": { "$ref": "#/$defs/sha256" }
      }
    }
  },
  "properties": {
    "schema": { "const": "klt.design_agent_benchmark.layout_task/1" },
    "id": {
      "type": "string",
      "pattern": "^[a-z0-9]+(-[a-z0-9]+)*$",
      "description": "Stable slug; must match the task's filename stem."
    },
    "title": { "type": "string", "minLength": 1 },
    "pdk": { "enum": ["sky130"], "description": "Open PDKs only; sky130 first." },
    "description": { "type": "string", "minLength": 1 },
    "block_spec": { "$ref": "task.schema.json#/properties/block_spec" },
    "frozen_netlist": {
      "allOf": [{ "$ref": "#/$defs/frozenFile" }],
      "description": "The schematic netlist LVS compares against. Frozen: the scorer reads this, never an agent-supplied copy."
    },
    "reference_layout": {
      "type": "object",
      "additionalProperties": false,
      "required": ["path", "sha256", "cell_name"],
      "description": "Repo-frozen layout that is DRC-clean and LVS-clean against `frozen_netlist` (eligibility rule `reference_layout_valid`). Never shown to an agent.",
      "properties": {
        "path": { "$ref": "#/$defs/repoPath" },
        "sha256": { "$ref": "#/$defs/sha256" },
        "cell_name": { "type": "string", "minLength": 1 }
      }
    },
    "generator_recipe": {
      "allOf": [{ "$ref": "#/$defs/frozenFile" }],
      "description": "A `klt gen`/`klt gen-compose` request that reaches a valid layout (eligibility rule `generator_reachable`). Proves the gen-only arm satisfiable; never shown to an agent."
    },
    "negative_controls": {
      "type": "array",
      "minItems": 1,
      "description": "Known-bad layouts the validity gate must reject (eligibility rule `negative_controls`).",
      "items": {
        "type": "object",
        "additionalProperties": false,
        "required": ["id", "path", "sha256", "expected_failure"],
        "properties": {
          "id": { "type": "string", "pattern": "^[a-z0-9]+(-[a-z0-9]+)*$" },
          "path": { "$ref": "#/$defs/repoPath" },
          "sha256": { "$ref": "#/$defs/sha256" },
          "expected_failure": { "enum": ["drc", "lvs"] }
        }
      }
    },
    "notes": { "type": ["string", "null"] }
  }
}
